{
  "schemaVersion": "knowledge-source-registry-v0.1",
  "registryVersion": "hv-k01a-inventory-2026-10-14",
  "updatedAt": "2026-10-14",
  "sources": [
    {
      "sourceId": "k01a-zwds-quanshu-vol1-wikisource-r7913704",
      "sourceKind": "transcription",
      "title": "紫微斗數全書/卷一",
      "creator": null,
      "edition": null,
      "publisher": "Chinese Wikisource",
      "publicationYear": null,
      "language": "zh-Hant",
      "knowledgeScopes": [
        "star-symbolism",
        "cross-palace-interpretation",
        "formations",
        "fortune-periods"
      ],
      "schoolClaims": [
        {
          "label": "Nam Phái",
          "claimStatus": "unverified",
          "evidenceNote": "Tên tác phẩm và cách repository cũ sử dụng không đủ xác nhận hệ phái."
        }
      ],
      "access": {
        "url": "https://zh.wikisource.org/w/index.php?title=紫微斗數全書/卷一&oldid=7913704",
        "accessType": "free-public",
        "lastCheckedAt": "2026-10-14",
        "lastObservedStatus": "HTTP 200; MediaWiki API xác nhận trang tồn tại",
        "robotsOrTermsNote": "Chỉ truy cập thủ công có giới hạn; chưa đánh giá tái sử dụng hàng loạt."
      },
      "rights": {
        "status": "open-license",
        "license": "Wikisource CC BY-SA/GFDL cho đóng góp biên tập; tình trạng văn bản nền phải xét riêng",
        "reusePolicy": "Chỉ lưu locator và trích dẫn tối thiểu sau review, kèm revision và attribution."
      },
      "provenance": {
        "locator": "Pinned revision 7913704, 卷一",
        "revision": "7913704",
        "contentDigest": null,
        "retrievalMethod": "Kiểm tra thủ công trang và MediaWiki API",
        "bibliographicIdentity": "Tác giả, bản in nền, NXB và năm chưa xác minh."
      },
      "independence": {
        "sourceFamilyId": "zwds-quanshu-textual-lineage-unresolved",
        "implementationFamilyId": null,
        "independenceStatus": "related",
        "basis": "Cùng tên tác phẩm với 卷二 và facsimile; không tính là family độc lập."
      },
      "status": "candidate",
      "limitations": [
        "Bản chép web, không phải complete chart oracle.",
        "Mô tả biểu tượng không tự hỗ trợ kết luận hành vi hoặc kết quả.",
        "Identity thư mục chưa được hai catalogue độc lập xác nhận."
      ],
      "supersedes": []
    },
    {
      "sourceId": "k01a-zwds-quanshu-vol2-wikisource-r1963110",
      "sourceKind": "transcription",
      "title": "紫微斗數全書/卷二",
      "creator": null,
      "edition": null,
      "publisher": "Chinese Wikisource",
      "publicationYear": null,
      "language": "zh-Hant",
      "knowledgeScopes": [
        "palace-placement",
        "major-star-placement",
        "auxiliary-star-placement",
        "transformations"
      ],
      "schoolClaims": [
        {
          "label": "Nam Phái",
          "claimStatus": "unverified",
          "evidenceNote": "Chưa có catalogue hoặc nghiên cứu hệ phái độc lập được review."
        }
      ],
      "access": {
        "url": "https://zh.wikisource.org/w/index.php?title=紫微斗數全書/卷二&oldid=1963110",
        "accessType": "free-public",
        "lastCheckedAt": "2026-10-14",
        "lastObservedStatus": "HTTP 200; MediaWiki API xác nhận trang tồn tại",
        "robotsOrTermsNote": "Chỉ truy cập thủ công có giới hạn; không crawl toàn site."
      },
      "rights": {
        "status": "open-license",
        "license": "Wikisource CC BY-SA/GFDL cho đóng góp biên tập; tình trạng văn bản nền phải xét riêng",
        "reusePolicy": "Chỉ lưu locator và trích dẫn tối thiểu sau review, kèm revision và attribution."
      },
      "provenance": {
        "locator": "Pinned revision 1963110, 卷二",
        "revision": "1963110",
        "contentDigest": null,
        "retrievalMethod": "Kiểm tra thủ công trang và MediaWiki API",
        "bibliographicIdentity": "Tác giả, bản in nền, NXB và năm chưa xác minh."
      },
      "independence": {
        "sourceFamilyId": "zwds-quanshu-textual-lineage-unresolved",
        "implementationFamilyId": null,
        "independenceStatus": "related",
        "basis": "Cùng textual lineage với 卷一; quan hệ với facsimile chưa được chứng minh độc lập."
      },
      "status": "candidate",
      "limitations": [
        "Chỉ phù hợp làm đầu mối trích xuất rule có locator sau review.",
        "Không xác định đầy đủ giờ Tý, lịch nhuận hoặc profile mặc định.",
        "Không chứng nhận Nam Phái độc lập."
      ],
      "supersedes": []
    },
    {
      "sourceId": "k01a-zwds-quanshu-facsimile-ia-ark-s23vzp6g9w0",
      "sourceKind": "facsimile",
      "title": "新鋟希夷陳先生紫微斗數全書（七卷）",
      "creator": "陳摶撰；潘希尹補輯（metadata do uploader cung cấp, chưa xác thực)",
      "edition": "Metadata ghi Minh đại Nam Dương Đường刊本",
      "publisher": "南陽堂 (theo metadata uploader)",
      "publicationYear": "1600 (theo metadata uploader)",
      "language": "zh-Hant",
      "knowledgeScopes": [
        "palace-placement",
        "major-star-placement",
        "auxiliary-star-placement",
        "star-symbolism",
        "formations",
        "fortune-periods"
      ],
      "schoolClaims": [
        {
          "label": "Nam Phái",
          "claimStatus": "unverified",
          "evidenceNote": "Archive metadata không đưa ra bằng chứng phân loại hệ phái."
        }
      ],
      "access": {
        "url": "https://archive.org/details/20260506_20260506_1217",
        "accessType": "free-public",
        "lastCheckedAt": "2026-10-14",
        "lastObservedStatus": "Metadata API HTTP 200; item có facsimile, OCR và ARK ark:/13960/s23vzp6g9w0",
        "robotsOrTermsNote": "Chỉ đọc metadata và leaf giới hạn; không tải PDF 853 MB hoặc sao chép toàn văn."
      },
      "rights": {
        "status": "unknown",
        "license": null,
        "reusePolicy": "Không phân phối scan/OCR; chỉ lưu URL, ARK và metadata nghiên cứu cho đến khi quyền được review."
      },
      "provenance": {
        "locator": "Internet Archive item 20260506_20260506_1217; ARK ark:/13960/s23vzp6g9w0",
        "revision": null,
        "contentDigest": null,
        "retrievalMethod": "Đọc metadata API và danh sách file; không tải toàn bộ",
        "bibliographicIdentity": "Metadata uploader ghi 7 quyển, 1600; chưa có catalogue thứ hai xác nhận edition/date."
      },
      "independence": {
        "sourceFamilyId": "zwds-quanshu-textual-lineage-unresolved",
        "implementationFamilyId": null,
        "independenceStatus": "unknown",
        "basis": "Facsimile có thể là nguồn vật lý nền của transcription; chưa đủ dữ liệu lineage."
      },
      "status": "blocked",
      "limitations": [
        "Quyền tái sử dụng không hiển thị trong metadata.",
        "OCR tự động không dùng làm passage chuẩn.",
        "Identity và niên đại chỉ do uploader cung cấp.",
        "Không được tính là family độc lập với Wikisource."
      ],
      "supersedes": []
    },
    {
      "sourceId": "k01a-hko-gregorian-lunar-tables-1901-2100",
      "sourceKind": "website",
      "title": "Gregorian-Lunar Calendar Conversion Table",
      "creator": "Hong Kong Observatory",
      "edition": "Bộ bảng 1901–2100",
      "publisher": "Hong Kong Observatory",
      "publicationYear": null,
      "language": "en",
      "knowledgeScopes": ["calendar"],
      "schoolClaims": [
        {
          "label": "not an astrology school source",
          "claimStatus": "not-applicable",
          "evidenceNote": "Nguồn lịch pháp chính thức, không định nghĩa an sao hoặc luận giải."
        }
      ],
      "access": {
        "url": "https://www.hko.gov.hk/en/gts/time/conversion.htm",
        "accessType": "free-public",
        "lastCheckedAt": "2026-10-14",
        "lastObservedStatus": "HTTP 200; trang liệt kê bảng PDF 1901–2100; PDF 2026 HTTP 200",
        "robotsOrTermsNote": "Truy cập thủ công; điều kiện tái sử dụng dữ liệu chưa được xác nhận."
      },
      "rights": {
        "status": "unknown",
        "license": null,
        "reusePolicy": "Dùng làm đối chiếu thủ công bằng locator; chưa nhập hàng loạt bảng cho đến khi review quyền."
      },
      "provenance": {
        "locator": "HKO conversion.htm; linked annual PDFs 1901–2100",
        "revision": null,
        "contentDigest": null,
        "retrievalMethod": "Đọc trang chỉ mục và mở mẫu PDF 2026",
        "bibliographicIdentity": "Cơ quan phát hành thể hiện trực tiếp trên host HKO."
      },
      "independence": {
        "sourceFamilyId": "hko-official-calendar-tables",
        "implementationFamilyId": null,
        "independenceStatus": "independent",
        "basis": "Bảng lịch cơ quan khí tượng, tách khỏi các engine Tử Vi đang khảo sát; vẫn cần xác định profile/múi giờ trước so sánh."
      },
      "status": "candidate",
      "limitations": [
        "Chỉ hỗ trợ lịch pháp, không hỗ trợ quy tắc Tử Vi.",
        "Cần xác nhận convention và timezone trước khi dùng expected.",
        "Chưa review license cho ingest tự động."
      ],
      "supersedes": []
    },
    {
      "sourceId": "k01a-usno-calendars-faq",
      "sourceKind": "website",
      "title": "Introduction to Calendars",
      "creator": "United States Naval Observatory, Astronomical Applications Department",
      "edition": null,
      "publisher": "United States Naval Observatory",
      "publicationYear": null,
      "language": "en",
      "knowledgeScopes": ["calendar", "research-method"],
      "schoolClaims": [
        {
          "label": "not an astrology school source",
          "claimStatus": "not-applicable",
          "evidenceNote": "Nguồn khái quát lịch pháp, không phải quy tắc Tử Vi."
        }
      ],
      "access": {
        "url": "https://aa.usno.navy.mil/faq/calendars",
        "accessType": "free-public",
        "lastCheckedAt": "2026-10-14",
        "lastObservedStatus": "HTTP 200; có mục Chinese Calendar ở mức tổng quan",
        "robotsOrTermsNote": "Chỉ đọc thủ công trang FAQ; không automation."
      },
      "rights": {
        "status": "unknown",
        "license": null,